Sheet: Sheet1
A1: Problem 3
A3: Yâ€™ = siny | B3: Y(0)=1 | C3: 0-.5 | D3: H=.1
A5: x | B5: y
A6: 0 | B6: 1
A7: of:=[.A6] + 0.1 -> 0.1 | B7: of:=[.B6] + SIN([.B6]) * 0.1 -> 1.08414709848079
A8: of:=[.A7] + 0.1 -> 0.2 | B8: of:=[.B7] + SIN([.B7]) * 0.1 -> 1.1725375847101
A9: of:=[.A8] + 0.1 -> 0.3 | B9: of:=[.B8] + SIN([.B8]) * 0.1 -> 1.26471135222136
A10: of:=[.A9] + 0.1 -> 0.4 | B10: of:=[.B9] + SIN([.B9]) * 0.1 -> 1.36006341029656
A11: of:=[.A10] + 0.1 -> 0.5 | B11: of:=[.B10] + SIN([.B10]) * 0.1 -> 1.45785119713209
A13: Problem 4
A15: x | B15: y | D15: x | E15: y
A16: 0 | B16: 0 | D16: 0 | E16: of:=10^-16 -> 1E-016
A17: of:=[.A16]+0.1 -> 0.1 | B17: of:=[.B16] + [.B16]^(1/3) * 0.01 -> 0 | D17: of:=[.D16]+0.1 -> 0.1 | E17: of:=[.E16] + [.E16] ^ (1/3) * 0.1 -> 0.000000464158883461278
A18: of:=[.A17]+0.1 -> 0.2 | B18: of:=[.B17] + [.B17]^(1/3) * 0.01 -> 0 | D18: of:=[.D17]+0.1 -> 0.2 | E18: of:=[.E17] + [.E17] ^ (1/3) * 0.1 -> 0.000774727841620192
A19: of:=[.A18]+0.1 -> 0.3 | B19: of:=[.B18] + [.B18]^(1/3) * 0.01 -> 0 | D19: of:=[.D18]+0.1 -> 0.3 | E19: of:=[.E18] + [.E18] ^ (1/3) * 0.1 -> 0.00995910524088409
A20: of:=[.A19]+0.1 -> 0.4 | B20: of:=[.B19] + [.B19]^(1/3) * 0.01 -> 0 | D20: of:=[.D19]+0.1 -> 0.4 | E20: of:=[.E19] + [.E19] ^ (1/3) * 0.1 -> 0.0314740436537033
A21: of:=[.A20]+0.1 -> 0.5 | B21: of:=[.B20] + [.B20]^(1/3) * 0.01 -> 0 | D21: of:=[.D20]+0.1 -> 0.5 | E21: of:=[.E20] + [.E20] ^ (1/3) * 0.1 -> 0.0630471646753305
A22: of:=[.A21]+0.1 -> 0.6 | B22: of:=[.B21] + [.B21]^(1/3) * 0.01 -> 0 | D22: of:=[.D21]+0.1 -> 0.6 | E22: of:=[.E21] + [.E21] ^ (1/3) * 0.1 -> 0.102847663956823
A23: of:=[.A22]+0.1 -> 0.7 | B23: of:=[.B22] + [.B22]^(1/3) * 0.01 -> 0 | D23: of:=[.D22]+0.1 -> 0.7 | E23: of:=[.E22] + [.E22] ^ (1/3) * 0.1 -> 0.149700024563876
A24: of:=[.A23]+0.1 -> 0.8 | B24: of:=[.B23] + [.B23]^(1/3) * 0.01 -> 0 | D24: of:=[.D23]+0.1 -> 0.8 | E24: of:=[.E23] + [.E23] ^ (1/3) * 0.1 -> 0.202797510334
A25: of:=[.A24]+0.1 -> 0.9 | B25: of:=[.B24] + [.B24]^(1/3) * 0.01 -> 0 | D25: of:=[.D24]+0.1 -> 0.9 | E25: of:=[.E24] + [.E24] ^ (1/3) * 0.1 -> 0.261549269239203
A26: of:=[.A25]+0.1 -> 1 | B26: of:=[.B25] + [.B25]^(1/3) * 0.01 -> 0 | D26: of:=[.D25]+0.1 -> 1 | E26: of:=[.E25] + [.E25] ^ (1/3) * 0.1 -> 0.325500833278324